[
  {
    "id": "ND-0101",
    "statement": "Агропредприятие должно получать телеметрию о состоянии посевов, почвы и сельскохозяйственной техники от терминалов класса A' в зоне обслуживания сельхозугодий с долей суточно доставленных сообщений не менее 0,90, чтобы планировать агротехнические операции при отсутствии наземной связи.",
    "stakeholder": {
      "name": "Агропредприятия",
      "role": "end_user",
      "priority": 3
    },
    "constraints": [
      "Р1: полезная нагрузка только regenerative",
      "Р2: терминал в форм-факторе 12U…100 кг",
      "Р3: межспутниковая связь только РЧ",
      "MOE группировки: не менее 200 000 активных терминалов (постановка миссии)"
    ],
    "lifecycle": {
      "status": "Draft",
      "version": "1"
    },
    "provenance": {
      "source": "ai_proposed"
    }
  },
  {
    "id": "ND-0102",
    "statement": "Агропредприятие должно получать подтверждение доставки команд управления поливом и внесением удобрений через терминалы класса B' с вероятностью подтверждённой доставки не менее 0,99 за двое суток, чтобы гарантировать исполнение агротехнических операций без наземной связи.",
    "stakeholder": {
      "name": "Агропредприятия",
      "role": "end_user",
      "priority": 4
    },
    "constraints": [
      "Р1: полезная нагрузка только regenerative",
      "Р2: терминал в форм-факторе 12U…100 кг"
    ],
    "lifecycle": {
      "status": "Draft",
      "version": "1"
    },
    "provenance": {
      "source": "ai_proposed"
    }
  },
  {
    "id": "ND-0103",
    "statement": "Агропредприятие должно доводить команды оперативного управления ирригационными и технологическими системами через терминалы класса C' за время не более 30 минут, чтобы предотвращать потери урожая при аварийных ситуациях.",
    "stakeholder": {
      "name": "Агропредприятия",
      "role": "end_user",
      "priority": 5
    },
    "constraints": [
      "Р4: маски доступа статические, без динамического планирования режимов",
      "Р3: межспутниковая связь только РЧ"
    ],
    "lifecycle": {
      "status": "Draft",
      "version": "1"
    },
    "provenance": {
      "source": "ai_proposed"
    }
  },
  {
    "id": "ND-0104",
    "statement": "Водоканал должен получать телеметрию уровня, давления и качества воды от датчиков сети водоснабжения через терминалы класса A' в зоне обслуживания объектов водоснабжения с долей суточно доставленных сообщений не менее 0,90, чтобы контролировать состояние сети без наземной связи.",
    "stakeholder": {
      "name": "Водоканалы",
      "role": "end_user",
      "priority": 3
    },
    "constraints": [
      "Р1: полезная нагрузка только regenerative",
      "Р2: терминал в форм-факторе 12U…100 кг"
    ],
    "lifecycle": {
      "status": "Draft",
      "version": "1"
    },
    "provenance": {
      "source": "ai_proposed"
    }
  },
  {
    "id": "ND-0105",
    "statement": "Водоканал должен получать подтверждение доставки аварийных сообщений о протечках и авариях на сети через терминалы класса B' с вероятностью подтверждённой доставки не менее 0,99 за двое суток, чтобы обеспечивать документированное реагирование на инциденты.",
    "stakeholder": {
      "name": "Водоканалы",
      "role": "end_user",
      "priority": 4
    },
    "constraints": [
      "Р1: полезная нагрузка только regenerative"
    ],
    "lifecycle": {
      "status": "Draft",
      "version": "1"
    },
    "provenance": {
      "source": "ai_proposed"
    }
  },
  {
    "id": "ND-0106",
    "statement": "Водоканал должен доводить команды оперативного управления задвижками и насосными станциями через терминалы класса C' за время не более 30 минут, чтобы предотвращать аварийные потери воды и обеспечивать безопасность сети.",
    "stakeholder": {
      "name": "Водоканалы",
      "role": "end_user",
      "priority": 5
    },
    "constraints": [
      "Р4: маски доступа статические, без динамического планирования режимов",
      "Р3: межспутниковая связь только РЧ"
    ],
    "lifecycle": {
      "status": "Draft",
      "version": "1"
    },
    "provenance": {
      "source": "ai_proposed"
    }
  },
  {
    "id": "ND-0107",
    "statement": "Энергосетевая компания должна получать подтверждение доставки сигналов о состоянии линий электропередач и подстанций через терминалы класса B' с вероятностью подтверждённой доставки не менее 0,99 за двое суток, чтобы обеспечивать контролируемое реагирование на нештатные ситуации в удалённых районах без наземной связи.",
    "stakeholder": {
      "name": "Энергосети",
      "role": "end_user",
      "priority": 4
    },
    "constraints": [
      "Р1: полезная нагрузка только regenerative",
      "Р2: терминал в форм-факторе 12U…100 кг"
    ],
    "lifecycle": {
      "status": "Draft",
      "version": "1"
    },
    "provenance": {
      "source": "ai_proposed"
    }
  },
  {
    "id": "ND-0108",
    "statement": "Энергосетевая компания должна доводить команды оперативного управления коммутационными аппаратами и переключениями в распределительной сети через терминалы класса C' за время не более 30 минут, чтобы минимизировать длительность и масштаб отключений в удалённых районах.",
    "stakeholder": {
      "name": "Энергосети",
      "role": "end_user",
      "priority": 5
    },
    "constraints": [
      "Р4: маски доступа статические, без динамического планирования режимов",
      "Р3: межспутниковая связь только РЧ"
    ],
    "lifecycle": {
      "status": "Draft",
      "version": "1"
    },
    "provenance": {
      "source": "ai_proposed"
    }
  },
  {
    "id": "ND-0201",
    "statement": "Логистическая компания нуждается в получении данных о местоположении и статусе грузового транспорта вне зоны наземной связи не реже одного раза в сутки, чтобы контролировать движение автопоездов и контейнеров на маршрутах без сотового покрытия (класс терминала A', суточная доставка не менее 0,90 по постановке миссии).",
    "stakeholder": {
      "name": "Логистическая компания (автомобильные и мультимодальные перевозки)",
      "role": "end_user",
      "priority": 2
    },
    "lifecycle": {
      "status": "Draft",
      "version": "1"
    },
    "provenance": {
      "source": "ai_proposed"
    }
  },
  {
    "id": "ND-0202",
    "statement": "Логистическая компания нуждается в подтверждённой доставке событийных сообщений о состоянии груза (вскрытие пломбы, нарушение температурного режима, отклонение от маршрута) с гарантией получения подтверждения за двое суток, чтобы фиксировать факт инцидента для расследования и претензионной работы (класс терминала B', подтверждённая доставка не менее 0,99 за двое суток по постановке миссии).",
    "stakeholder": {
      "name": "Логистическая компания (автомобильные и мультимодальные перевозки)",
      "role": "end_user",
      "priority": 2
    },
    "lifecycle": {
      "status": "Draft",
      "version": "1"
    },
    "provenance": {
      "source": "ai_proposed"
    }
  },
  {
    "id": "ND-0203",
    "statement": "Логистическая компания нуждается в оперативном доведении команды блокировки транспортного средства или изменения маршрута до терминала за 30 минут, чтобы предотвратить хищение груза или направить транспорт в объезд закрытого участка (класс терминала C', доведение команды за 30 минут по постановке миссии).",
    "stakeholder": {
      "name": "Логистическая компания (автомобильные и мультимодальные перевозки)",
      "role": "end_user",
      "priority": 3
    },
    "lifecycle": {
      "status": "Draft",
      "version": "1"
    },
    "provenance": {
      "source": "ai_proposed"
    }
  },
  {
    "id": "ND-0204",
    "statement": "Предприятие морского промысла нуждается в получении координат и параметров хода промысловых судов и буёв вне зоны действия берегового покрытия не реже одного раза в сутки, чтобы вести учёт районов промысла и обеспечивать безопасность экипажей (класс терминала A', суточная доставка не менее 0,90 по постановке миссии).",
    "stakeholder": {
      "name": "Предприятие морского промысла",
      "role": "end_user",
      "priority": 2
    },
    "lifecycle": {
      "status": "Draft",
      "version": "1"
    },
    "provenance": {
      "source": "ai_proposed"
    }
  },
  {
    "id": "ND-0205",
    "statement": "Предприятие морского промысла нуждается в подтверждённой передаче данных о суточном улове и промысловой обстановке с получением подтверждения доставки за двое суток, чтобы обеспечить отчётность перед контролирующими органами по квотам (класс терминала B', подтверждённая доставка не менее 0,99 за двое суток по постановке миссии).",
    "stakeholder": {
      "name": "Предприятие морского промысла",
      "role": "end_user",
      "priority": 2
    },
    "lifecycle": {
      "status": "Draft",
      "version": "1"
    },
    "provenance": {
      "source": "ai_proposed"
    }
  },
  {
    "id": "ND-0206",
    "statement": "Предприятие морского промысла нуждается в оперативном доведении команды об изменении района промысла или сигнала возврата судна до терминала за 30 минут, чтобы своевременно реагировать на штормовое предупреждение или закрытие промыслового района (класс терминала C', доведение команды за 30 минут по постановке миссии).",
    "stakeholder": {
      "name": "Предприятие морского промысла",
      "role": "end_user",
      "priority": 3
    },
    "lifecycle": {
      "status": "Draft",
      "version": "1"
    },
    "provenance": {
      "source": "ai_proposed"
    }
  },
  {
    "id": "ND-0207",
    "statement": "Геологоразведочная организация нуждается в получении показаний автономных датчиков и станций мониторинга, размещённых в удалённых районах без наземной связи, не реже одного раза в сутки, чтобы отслеживать сейсмическую и гидрологическую обстановку на объектах разведки (класс терминала A', суточная доставка не менее 0,90 по постановке миссии).",
    "stakeholder": {
      "name": "Геологоразведочная организация",
      "role": "end_user",
      "priority": 3
    },
    "lifecycle": {
      "status": "Draft",